{"spec_version":1,"name":"Staff table","source":{"url":"https://example.com/staff"},
 "extract":{"container":"#staff tr","fields":[
   {"name":"name","selector":"td:nth-of-type(1)","required":true},
   {"name":"email","selector":"td:nth-of-type(2)","type":"email"},
   {"name":"phone","selector":"td:nth-of-type(3)","type":"phone"}]}}
